title,journal,pubDate
Radiology–Pathology Correlation Demonstrating Organizing Pneumonia in a Patient Who Recovered from COVID-19,American Journal of Respiratory and Critical Care Medicine,2020-08-15
Immuno-pathogenesis of nCOVID-19 and a possible host-directed therapy including anti-inflammatory and anti-viral prostaglandin (PG J) for effective treatment and reduction in the death toll,Medical Hypotheses,2020-07-08
Age-Related Differences in Immunological Responses to SARS-CoV-2,The Journal of Allergy and Clinical Immunology. in Practice,2020-08-27
"New Drugs Regulatory Program Modernization: Vision, Strategic Objectives, and Impact",Therapeutic Innovation & Regulatory Science,2020-10-26
COVID-19 Symptoms: Longitudinal Evolution and Persistence in Outpatient Settings,Annals of Internal Medicine,2020-12-08
Cross-Sectional Analysis of the Complaints and Emergency Department Attendances During COVID-19 Pandemic,Cureus,2020-12-12
Osmotic Adaptation by Na-Dependent Transporters and ACE2: Correlation with Hemostatic Crisis in COVID-19,Biomedicines,2020-10-30
Cancer Prevales on Covid‐19: To Maintain a High Quality Standard Concerning Diagnosis and Oncological Care Even During a Pandemic,Journal of Medical Virology,2020-06-17
"Epidemiological characteristics and transmissibility of shigellosis in Hubei Province, China, 2005 – 2017",BMC Infectious Diseases,2020-04-07
"Archaeology and contemporary death: Using the past to provoke, challenge and engage",PLoS ONE,2020-12-29
Association between trace levels of lithium in drinking water and COVID‐19‐associated mortality,Bipolar Disorders,2020-09-30
"Media for Coping During COVID-19 Social Distancing: Stress, Anxiety, and Psychological Well-Being",Frontiers in Psychology,2020-12-18
panorama,Procare,2020-05-16
Asthma and COVID-19: In Defense of Evidence-Based SABA,Journal of Asthma and Allergy,2020-10-15
A Simple Bayesian Method for Evaluating Whether Data From Patients With Rheumatic Diseases Who Have Been Under Chronic Hydroxychloroquine Medication Since Before the COVID-19 Outbreak Can Speak to Hydroxychloroquine's Prophylactic Effect Against Infection With SARS-CoV-2,Frontiers in Medicine,2020-08-13
Clinically suspected myocarditis in the course of coronavirus infection,European Heart Journal,2020-04-27
"Differences Between Health Workers and General Population in Risk Perception, Behaviors, and Psychological Distress Related to COVID-19 Spread in Italy",Frontiers in Psychology,2020-09-04
Nur Datensicherung bringt wirklich Sicherheit,Versicherungsmagazin,2020-11-27
Mitteilungen der GI im Informatik Spektrum 3/2020,Informatik Spektrum,2020-05-05
Temporal Changes of CT Findings in 90 Patients with COVID-19 Pneumonia: A Longitudinal Study,Radiology,2020-03-19
Identifying the Real Effects of Zombie Lending,The Review of Corporate Finance Studies,2020-07-07
National response strategies and marketing innovations during the COVID-19 pandemic,Business Horizons,2020-12-09
"Developing Effective Methods for Electronic Health Personalization: Protocol for Health Telescope, a Prospective Interventional Study",JMIR Research Protocols,2020-07-31
Lehren und Chancen für Anleger,Uro-News,2020-11-13
Commentary: Preferred practice pattern for primary eye care in the context of COVID-19 in L V Prasad Eye Institute network in India,Indian Journal of Ophthalmology,2020-07-01
Setting Goals or Shifting Goalposts: Role of Frailty for Critical Care Decisions During COVID-19,The Journal of Frailty & Aging,2020-09-02
Remdesivir in patients with estimated glomerular filtration rate < 30mL/min/1.73m or on renal replacement therapy,Kidney International Reports,2020-11-27
COVID-19 and Pulmonology in the XXI century: Challenge or Opportunity?,Archivos De Bronconeumologia,2020-05-28
Survey of Intravitreal Injection Techniques Among Retina Specialists in Mexico,"Clinical Ophthalmology (Auckland, N.Z.)",2020-11-26
COVID-Well: Evaluation of the Implementation of Supported Wellbeing Centres for Hospital Employees during the COVID-19 Pandemic,International Journal of Environmental Research and Public Health,2020-12-15
COVID-19 in the radiology department: What radiographers need to know,"Radiography (London, England : 1995)",2020-06-04
Response and Suggestions for: Factors Associated with Burnout Among Physicians: an Evaluation During a Period of COVID-19 Pandemic [Letter],Journal of Healthcare Leadership,2020-11-11
Critically Ill Patients with COVID-19: A Narrative Review on Prone Position,Pulmonary Therapy,2020-10-21
Medical Students in the Time of COVID‐19: Opportunities and Challenges,AEM Education and Training,2020-06-13
"Current Resources for Evidence-Based Practice, November 2020","Journal of Obstetric, Gynecologic, and Neonatal Nursing",2020-10-21
Cancer or COVID-19? A Review of Guidelines for Safe Cancer Care in the Wake of the Pandemic,Sn Comprehensive Clinical Medicine,2020-11-21
COVID-19 response in the Middle East and north Africa: challenges and paths forward,The Lancet. Global Health,2020-05-14
Quercetin and Its Metabolites Inhibit RecombinantHuman Angiotensin-Converting Enzyme 2 (ACE2) Activity,Journal of Agricultural and Food Chemistry,2020-11-12
Incidence of Health Care–Associated COVID-19 During Universal Testing of Medical and Surgical Admissions in a Large US Health System,Open Forum Infectious Diseases,2020-09-14
Mandated societal lockdown and road traffic accidents,Accident; Analysis and Prevention,2020-09-07
"Quality assessment of clinical practice guidelines for the management of paediatric dental emergencies applicable to the COVID-19 pandemic, using the AGREE II instrument. A systematic review",Heliyon,2020-12-09
A Tempo-geographic Analysis of Global COVID-19 Epidemic Outside of China,medRxiv,2020-04-16
Exploring uncertainty and risk in the accelerated response to a COVID-19 vaccine: Perspective from the pharmaceutical industry,Vaccine,2020-10-13
Analysis of Glucose Levels in Patients Hospitalized With COVID-19 During the First Phase of This Pandemic in West Texas,Journal of Primary Care & Community Health,2020-09-13
N-95 masks: how much do we know?,The Egyptian Journal of Internal Medicine,2020-08-31
Caught in the crossfire:  cancer surgery in the midst of ‐19,The British Journal of Surgery,2020-06-22
Antimicrobial peptides – Advances in development of therapeutic applications,Life Sciences,2020-09-12
European Coronationalism? A Hot Spot Governing a Pandemic Crisis,Public Administration Review,2020-05-22
Liver injury in COVID-19: management and challenges,The Lancet. Gastroenterology & Hepatology,2020-03-04
Trends in Clinical Information Systems Research in 2019: An Overview of the Clinical Information Systems Section of the International Medical Informatics Association Yearbook,Yearbook of Medical Informatics,2020-08-21
The challenges of COVID-19 for community pharmacists and opportunities for the future,Irish Journal of Psychological Medicine,2020-05-21
"Two small, cysteine-rich and cationic antifungal proteins from : A comparative study of PAF and PAFB",Biochimica et Biophysica Acta. Biomembranes,2020-03-03
The fight against COVID-19: a report from the Italian trenches,International Psychogeriatrics,2020-04-20
Restricted Arm Swing in People With Parkinson's Disease Decreases Step Length and Time on Destabilizing Surfaces,Frontiers in Neurology,2020-09-25
Analysis of Characteristics in Death Patients with COVID-19 Pneumonia without Underlying Diseases,Academic Radiology,2020-04-07
Potential Therapeutic Targeting of Coronavirus Spike Glycoprotein Priming,Molecules,2020-05-22
COVID-19 international neurological registries,The Lancet. Neurology,2020-05-26
"Air, Air Everywhere!",Clinical Case Reports,2020-08-20
"COVID-19 and community pharmacy services in Pakistan: challenges, barriers and solution for progress",Journal of Pharmaceutical Policy and Practice,2020-06-15
Markers of myocardial injury in the prediction of short-term COVID-19 prognosis,Revista Espanola De Cardiologia (English Ed.),2020-09-29
The Role of the Patient-Centered Medical Home in Treating Depression,Current Psychiatry Reports,2020-07-14
The strategies for the coronavirus disease 2019 (COVID-19) in Taiwan: A different tale,The Journal of Infection,2020-08-10
Imaging in COVID-19-related myocardial injury,The International Journal of Cardiovascular Imaging,2020-11-19
Using latent class analysis to identify the complex needs of youth on probation,Children and Youth Services Review,2020-05-19
Is there relationship between SARS-CoV-2 and the complement C3 and C4?,Turkish Journal of Medical Sciences,2020-06-23
Environmental and psychological variables influencing reactions to the COVID‐19 outbreak,British Journal of Health Psychology,2020-09-19
Convalescent plasma from COVID 19 patients enhances intensive care unit survival rate. A preliminary report,Transfusion and Apheresis Science,2020-06-10
Correction to: A survival analysis of COVID-19 in the Mexican population,BMC Public Health,2020-11-30
Elevated ACE-2 expression in the olfactory neuroepithelium: implications for anosmia and upper respiratory SARS-CoV-2 entry and replication,The European Respiratory Journal,2020-09-24
Warum der rehabilitativen Versorgung auch und gerade währendder COVID-19 Pandemie besondere Beachtung geschenkt werden muss: Ein Statementder Deutschen Gesellschaft für Physikalische und Rehabilitative Medizin(DGPRM),"Physikalische Medizin, Rehabilitationsmedizin, Kurortmedizin",2020-07-15
Comparison of Mobile Health Technology Use for Self-Tracking Between Older Adults and the General Adult Population in Canada: Cross-Sectional Survey,JMIR mHealth and uHealth,2020-11-27
CoViD-19 Immunopathology and Immunotherapy,Bioinformation,2020-03-31
EP14 COVID-19 associated aortitis,Rheumatology Advances in Practice,2020-11-03
Double Jeopardy: Methamphetamine Use and HIV as Risk Factors for COVID-19,AIDS and Behavior,2020-04-07
Exploring COVID-19 Therapies: An Extraordinary Global Challenge,Journal of Digestive Endoscopy,2020-05-16
"Instagram as a Window to Societal Perspective on Mental Health, Gender, and Race: Observational Pilot Study",JMIR Mental Health,2020-10-27
Retinal findings in COVID-19 patients with diabetes mellitus,Diabetes Research and Clinical Practice,2020-08-29
Lead compounds for the development of SARS-CoV-2 3CL protease inhibitors,bioRxiv,2020-08-04
Keeping pace: An ED communications strategy for COVID-19,The American Journal of Emergency Medicine,2020-04-14
Science over stigma: the need for evidence-based blood donation policies for men who have sex with men in the USA,The Lancet. Haematology,2020-10-19
A Strategy to Prevent and Control Zoonoses?,The Hastings Center Report,2020-06-29
Taking a lesson from the COVID-19 pandemic: Preventing the future outbreaks of viral zoonoses through a multi-faceted approach,The Science of the Total Environment,2020-11-14
"A New Normal?: The COVID‐19 pandemic has heralded different ways of working, triage of workload, collaborative research and cold‐site surgery.",Bju International,2020-08-09
Drought Influences on Food Insecurity in Africa: A Systematic Literature Review,International Journal of Environmental Research and Public Health,2020-08-14
Extended use or reuse of N95 respirators during COVID-19 pandemic: An overview of national regulatory authority recommendations,Infection Control and Hospital Epidemiology,2020-04-22
Letter to the Editor: “COVID-19 Pandemic in Developing Countries: Effects on Urgent Neurosurgical Consultation and Patients' Care: Experience from North Africa”,World Neurosurgery,2020-08-24
Patient-Centered Surgical Care Meets the Social Determinants of Health,World Journal of Surgery,2020-09-25
Consensus statement on coronary intervention during the coronavirus disease 19 pandemic: from the Korean Society of Interventional Cardiology,The Korean Journal of Internal Medicine,2020-07-01
Considerations for STI Clinics During the COVID-19 Pandemic,Sexually Transmitted Diseases,2020-05-05
Trade credit research before and after the global financial crisis of 2008 – A bibliometric overview,Research in International Business and Finance,2020-06-30
How should I manage immunosuppression in a kidney transplant patient with COVID-19? An ERA-EDTA DESCARTES expert opinion,Nephrology Dialysis Transplantation,2020-05-22
Coronavirus: Schutzkleidung wird zentral bestellt und bezahlt: Infektionsschutz,Mmw Fortschritte Der Medizin,2020-03-30
Age Differences in Risk and Resilience Factors in COVID-19-Related Stress,The Journals of Gerontology Series B: Psychological Sciences and Social Sciences,2020-08-03
The dysregulated innate immune response in severe COVID-19 pneumonia that could drive poorer outcome,Journal of Translational Medicine,2020-12-03
COVID-19 provides an opportunity to advance a sustainable UK fisheries policy in a post-Brexit brave new world,Marine Policy,2020-07-10
Allium fistulosum congee as a home remedy to ward off the corona virus at an early stage,Integrative Medicine Research,2020-06-30
"Perceived Leadership Styles, Outcomes of Leadership, and Self-Efficacy Among Nurse Leaders:: A Hospital-Based Survey to Inform Leadership Development at a US Regional Medical Center",Nurse Leader,2020-10-01
A twin challenge to handle: COVID‐19 with pregnancy,Journal of Medical Virology,2020-04-05
Associations Between Primary Care Provider Shortage Areas and County-Level COVID-19 Infection and Mortality Rates in the USA,Journal of General Internal Medicine,2020-08-21
Susceptible supply limits the role of climate in the early SARS-CoV-2 pandemic,"Science (New York, N.y.)",2020-05-18
"Early, low-dose, short-term methylprednisolone decreased the mortality in critical COVID-19 patients: A multicenter retrospective cohort study",The Journal of Infection,2020-11-08
"Novel coronavirus 2019, an emerging public health emergency",Transboundary and Emerging Diseases,2020-02-19
Blockchain as an Approach for Secure Data Storage on Digital Consulting Platforms,Digital Entrepreneurship,2020-06-25
"Fighting ‐19 with Agility, Transparency, and Participation: Wicked Policy Problems and New Governance Challenges",Public Administration Review,2020-05-20
Efficient chromatin accessibility mapping in situ by nucleosome-tethered tagmentation,eLife,2020-11-16
Measuring progress towards healthy working lives,The Lancet. Public Health,2020-06-30
Update on COVID-19 From the Journal,Circulation. Cardiovascular Imaging,2020-04-23
Coronavirus Disease 2019 (COVID-19) in Neonates and Children From China: A Review,Frontiers in Pediatrics,2020-05-15
Comparison of Clinical Features of COVID-19 vs Seasonal Influenza A and B in US Children,JAMA Network Open,2020-09-08
Twitter reveals human mobility dynamics during the COVID-19 pandemic,PLoS ONE,2020-11-10
COVID-19 and a novel initiative to improve safety by 3D printing personal protective equipment parts from computed tomography,3D Printing in Medicine,2020-08-12
"SARS-CoV-2 meta-interactome suggests disease-specific, autoimmune pathophysiologies and therapeutic targets",F1000Research,2020-08-17
Cooperation in times of COVID-19: realizing the right to health in developing countries,Zeitschrift für Friedens- und Konfliktforschung,2020-11-13
"Prevention, susceptibility, and clinical features of coronavirus disease 2019 in postoperative patients",Asian Journal of Surgery,2020-10-16
Positive SARS-CoV-2 RNA recurs repeatedly in a case recovered from COVID-19: dynamic results from 108 days of follow-up,Pathogens and Disease,2020-06-27
Coronavirus Disease (COVID-19) and the Gastrointestinal System in Children,Indian Pediatrics,2020-07-07
COVID-19 and the importance of space in entrepreneurship research and policy,International Small Business Journal: Researching Entrepreneurship,2020-10-15
Peptidyl Fluoromethyl Ketones and Their Applications in Medicinal Chemistry,Molecules,2020-09-03
The global burden of trauma during the COVID-19 pandemic: A scoping review,Journal of Clinical Orthopaedics and Trauma,2020-11-14
COVID-19-associated takotsubo cardiomyopathy,BMJ Case Reports,2020-12-12
"Temporal, Spatial, and Epidemiologic Relationships of SARS-CoV-2 Gene Cycle Thresholds: A Pragmatic Ambi-directional Observation",Clinical Infectious Diseases: An Official Publication of the Infectious Diseases Society of America,2020-08-25
Establishing Safe Out-of-Hospital Infusion Centers May Improve the Quality of Care in Patients With IBD During the COVID-19 Pandemic,Inflammatory Bowel Diseases,2020-09-09
The COVID-19 pandemic in developing countries: A new opportunity to improve the monitoring of patients with diabetes mellitus,Diabetes & Metabolic Syndrome,2020-09-22
COVID‐19 Impacts Mental Health Outcomes and Ability/Desire to Participate in Research Among Current Research Participants,"Obesity (Silver Spring, Md.)",2020-08-26
Generalization of extinction with a generalization stimulus is determined by learnt threat beliefs,Behaviour Research and Therapy,2020-10-22
Spatiotemporal patterns and trends of community transmission of the pandemic COVID-19 in South Asia: Bangladesh as a case study,Biosafety and Health,2020-09-23
"Reply to Amit Bansal and Anant Kumar’s Letter to the Editor re: Lan Zhu, Nianqiao Gong, Bin Liu, et al. Coronavirus Disease 2019 Pneumonia in Immunosuppressed Renal Transplant Recipients: A Summary of 10 Confirmed Cases in Wuhan, China. Eur Urol 2020;77:748–54",European Urology,2020-07-04
Thromboembolism risk of COVID-19 is high and associated with a higher risk of mortality: A systematic review and meta-analysis,EClinicalMedicine,2020-11-20
The COVID‐19 Pandemic and Its Impact on Children in Domestic Violence Refuges,"Child Abuse Review (Chichester, England : 1992)",2020-08-18
Covid -19 : report des échéances déclaratives,Option/Bio,2020-06-18
Examen in Corona-Zeiten,Pflege Zeitschrift,2020-08-21
Post-COVID-19 Action: Guarding Africa’s Crops against Viral Epidemics Requires Research Capacity Building That Unifies a Trio of Transdisciplinary Interventions,Viruses,2020-11-09
18.I. Workshop: Opportunities for EU funding in health,The European Journal of Public Health,2020-09-30
Pathology of TB/COVID-19 Co-Infection: The phantom menace,"Tuberculosis (Edinburgh, Scotland)",2020-11-17
The emerging role of clinical informatics fellows in service learning during the COVID-19 pandemic,Journal of the American Medical Informatics Association : JAMIA,2020-11-04
Tough Decisions During the COVID 19 Pandemic: A Frail Latino Patient,Gerontology and Geriatric Medicine,2020-11-04
"A PAN-POSITIVE, RAPIDLY PROGRESSIVE PULMONARY RENAL PUZZLER",Chest,2020-10-12
Capturing the Perspective of Prospective Urology Applicants: Impacts of COVID-19 on Medical Education,Urology,2020-09-30
Management of gynecologic cancer: Choosing radiotherapy wisely by 3 Southern Ontario academic centers during the COVID-19 pandemic,Radiotherapy and Oncology,2020-07-13
The  Commission on Gender and Global Health,"Lancet (London, England)",2020-08-04
Corticosteroid therapy for critically ill patients with COVID-19: A structured summary of a study protocol for a prospective meta-analysis of randomized trials,Trials,2020-08-24
Randomised controlled trial of tailored support to increase physical activity and reduce smoking in smokers not immediately ready to quit: protocol for the Trial of physical Activity-assisted Reduction of Smoking (TARS) Study,BMJ Open,2020-12-01
COVID-19: Current Trends in Invitro Diagnostics,Indian Journal of Clinical Biochemistry,2020-06-27
Clinical management and mortality among COVID-19 cases in sub-Saharan Africa: A retrospective study from Burkina Faso and simulated case analysis,International Journal of Infectious Diseases,2020-09-26
actueel,Tijdschrift Voor Verzorgenden,2020-05-08
Appointment characteristics in an allergy/immunology practice in the immediate aftermath of COVID-19 restrictions,The Journal of Allergy and Clinical Immunology. in Practice,2020-05-26
Protective Immunity against SARS Subunit Vaccine Candidates Based on Spike Protein: Lessons for Coronavirus Vaccine Development,Journal of Immunology Research,2020-07-18
Marine natural compounds as potents inhibitors against the main protease of SARS-CoV-2—a molecular dynamic study,Journal of Biomolecular Structure & Dynamics,2020-06-01
Between the Nonhuman and Inhuman: The Challenge of the Posthuman for Art|Education in the Twenty-First Century,Pedagogical Explorations in a Posthuman Age,2020-05-05
Desempeño de la definición de caso sospechoso de influenza antes y durante la pandemia por COVID-19,Revista Clinica Espanola,2020-10-01
Adapting IAPT services to support frontline NHS staff during the Covid-19 pandemic: the Homerton Covid Psychological Support (HCPS) pathway,Cognitive Behaviour Therapist,2020-04-28
Addressing opioid overdose deaths: The vision for the HEALing communities study,Drug and Alcohol Dependence,2020-10-01
"Vascular risk factors, Framingham risk score, and COVID-19: community-based cohort study",Cardiovascular Research,2020-07-16
Mindfulness and Psychological Distress in Kindergarten Teachers: The Mediating Role of Emotional Intelligence,International Journal of Environmental Research and Public Health,2020-11-06
Interpretation of the diagnosis and treatment plan of Corona Virus Disease 2019 (tentative fifth revised edition),"Global Health Journal (Amsterdam, Netherlands)",2020-03-17
Natural Products with Potential to Treat RNA Virus Pathogens IncludingSARS-CoV-2,Journal of Natural Products,2020-12-22
"Validation of a yellow fever vaccine model using data from primary vaccination in children and adults, re-vaccination and dose-response in adults and studies with immunocompromised individuals",BMC Bioinformatics,2020-12-14
Letter from the Editor-in-Chief,Journal of Contemporary Brachytherapy,2020-10-30
SARS-CoV-2 Main Protease: A Molecular DynamicsStudy,Journal of Chemical Information and Modeling,2020-07-17
Impact of international travel dynamics on domestic spread of 2019-nCoV in India: origin-based risk assessment in importation of infected travelers,Globalization and Health,2020-05-12
Leveraging Existing Strategies of Medication Stewardship to Preserve and Appropriately Use Critical Supplies,Mayo Clinic Proceedings,2020-09-15
A Narrative Review of COVID-19: The New Pandemic Disease,Iranian Journal of Medical Sciences,2020-07-01
"“Hemolysis, or not Hemolysis, that is the Question”. Use of Hydroxychloroquine in a Patient with COVID-19 Infection and G6PD Deficiency",Mediterranean Journal of Hematology and Infectious Diseases,2020-11-01
Is Net Zero Carbon 2050 Possible?,Joule,2020-09-11
Dishonesty and mandatory mask wearing in the COVID-19 pandemic,Economics Letters,2020-10-08
A pandemic of cognitive bias,Intensive Care Medicine,2020-10-27
Epidemiological evidence for association between higher influenza vaccine uptake in the elderly and lower COVID‐19 deaths in Italy,Journal of Medical Virology,2020-06-09
The Learning Health System in Crisis: Lessons from the Novel Coronavirus Disease Pandemic,"Mayo Clinic Proceedings: Innovations, Quality & Outcomes",2020-10-29
Persistent symptoms 1.5–6 months after COVID-19 in non-hospitalised subjects: a population-based cohort study,Thorax,2020-12-03
COVID-19 convalescent plasma clears SARS-CoV-2 refractory to remdesivir in an infant with congenital heart disease,Blood Advances,2020-09-11
ARDD 2020: from aging mechanisms to interventions,Aging (Albany NY),2020-12-30
The aerosol box for intubation in coronavirus disease 2019 patients: an in‐situ simulation crossover study,Anaesthesia,2020-06-01
COVID-19: a short message to rheumatologists,Reumatologia,2020-06-29
Pharmacological Activity of Eriodictyol: The Major Natural Polyphenolic Flavanone,Evidence-based Complementary and Alternative Medicine : eCAM,2020-12-12
Mental Health and Psychosocial Aspects of Coronavirus Outbreak in Pakistan: Psychological Intervention for Public Mental Health Crisis,Asian Journal of Psychiatry,2020-04-16
Warfarin-Induced Calciphylaxis in a COVID-19 Patient,Cureus,2020-12-24
Hotel managers’ perceptions towards the use of robots: a mixed-methods approach,Information Technology & Tourism,2020-09-12
Testing of Commercial Masks and Respirators and Cotton Mask InsertMaterials using SARS-CoV-2 Virion-Sized Particulates: Comparison of IdealAerosol Filtration Efficiency versus Fitted FiltrationEfficiency,Nano Letters,2020-09-28
Comparison of different serological assays for SARS-CoV-2 in real life,Journal of Clinical Virology,2020-08-02
Recent Advances in the Synthesis and Biological Activity of 8-Hydroxyquinolines,Molecules,2020-09-21
Integrative illustration for coronavirus outreach,PLoS Biology,2020-08-06
COVID-19 Infection in Men on Testosterone Replacement Therapy,The Journal of Sexual Medicine,2020-10-09
COVID‐19 is an emergent disease of aging,Aging Cell,2020-10-01
Co-production of an intervention to increase retention of early career nurses: Acceptability and feasibility,Nurse Education in Practice,2020-08-15
Hydroxychloroquine and Azithromycin to Treat Patients With COVID‐19: Both Friends and Foes?,Journal of Clinical Pharmacology,2020-05-20
Virtual Music Therapy: Developing New Approaches to Service Delivery,Music Therapy Perspectives,2020-09-08
"Highlights of the issue 6, 2020",Neurological Sciences,2020-05-29
Survival Analysis of Treatment Efficacy in Comparative Coronavirus Disease 2019 Studies,Clinical Infectious Diseases: An Official Publication of the Infectious Diseases Society of America,2020-10-14
824. Isolation Rounding - Enforcing Existing Isolation Policies to Conserve Personal Protective Equipment,Open Forum Infectious Diseases,2020-12-31
Safety perspectives on presently considered drugs for the treatment of COVID‐19,British Journal of Pharmacology,2020-07-17
COVID-19 Severe acute respiratory syndrome coronavirus 2 (SARS-CoV-2) infection in children and adolescents: a systematic review of critically unwell children and the association with underlying comorbidities,European Journal of Pediatrics,2020-09-10
