title,journal,pubDate
Dramatic presentation of acquired thrombotic thrombocytopenic purpura associated with COVID-19,Haematologica,2020-10-01
The Role of Lung Ultrasound in the Assessment of Novel Coronavirus Pneumonia,Journal of Cardiothoracic and Vascular Anesthesia,2020-04-30
China’s Internationalized Higher Education During Covid-19: Collective Student Autoethnography,Postdigital Science and Education,2020-05-08
Neutralizing Antibodies against SARS-CoV-2 and Other Human Coronaviruses,Trends in Immunology,2020-04-02
Probabilistic reconstruction of measles transmission clusters from routinely collected surveillance data,Journal of the Royal Society Interface,2020-07-01
Mehr Geriatrisches Assessment gefordert,Im Fokus Onkologie,2020-12-14
Potential therapeutic target identification in the novel 2019 coronavirus: insight from homology modeling and blind docking study,The Egyptian Journal of Medical Human Genetics,2020-10-02
Home Dialysis in the Time of COVID-19: Reflections on Rapidly Changing Policies,Kidney Medicine,2020-11-24
The coronavirus (COVID‐19) fatality risk perception of US adult residents in March and April 2020,British Journal of Health Psychology,2020-06-10
A critical turn in marine spatial planning,Maritime Studies,2020-08-25
A Smart Band for Automatic Supervision of Restrained Patients in a Hospital Environment,"Sensors (Basel, Switzerland)",2020-09-12
Papular‐purpuric exanthem in a COVID‐19 patient: clinical and dermoscopic description,Journal of the European Academy of Dermatology and Venereology,2020-06-29
Optogenetic control of gut bacterial metabolism to promote longevity,eLife,2020-12-16
Primer caso de infección neonatal por SARS-CoV-2 en España,"Anales De Pediatria (Barcelona, Spain : 2003)",2020-03-31
Role of Complementary and Alternative Medicine in Prevention and Treatment of COVID-19: An Overhyped Hope,Chinese Journal of Integrative Medicine,2020-08-05
To Tweet or Not to Tweet—a Review of the Viral Power of Twitter for Infectious Diseases,Current Infectious Disease Reports,2020-04-24
Hybrid 3D printed-paper microfluidics,Scientific Reports,2020-10-27
The MERS-CoV Receptor DPP4 as a Candidate Binding Target of the SARS-CoV-2 Spike,iScience,2020-05-13
Alternatives to sharing COVID-19 data with law enforcement: recommendations for stakeholders,"Health Policy (Amsterdam, Netherlands)",2020-11-07
Letter to editor “A redeployment model of surgery residents to COVID-19 diagnostic and treatment zone (CDTZ). A safe and cost-effective strategy in a middle income country”,"International Journal of Surgery (London, England)",2020-10-31
Application of Article 107(2)(b) TFEU to Covid-19 Measures: State Aid to Make Good the Damage Caused by an Exceptional Occurrence,Journal of European Competition Law & Practice,2020-06-16
A thrombotic complication of COVID-19: cerebral ischaemia in the intensive care unit,Archives of Medical Sciences. Atherosclerotic Diseases,2020-09-10
"Microbial enzymes catalyzing keratin degradation: Classification, structure, function",Biotechnology Advances,2020-08-05
Dynamic changes in clinical and CT characteristics of COVID-19 cases with different exposure histories: a retrospective study,BMC Infectious Diseases,2020-08-03
A mechanism-based parameterisation scheme to investigate the association between transmission rate of COVID-19 and meteorological factors on plains in China,The Science of the Total Environment,2020-06-18
Coronaviruses in the Sea,Frontiers in Microbiology,2020-07-24
Paid family leave and children health outcomes in OECD countries,Children and Youth Services Review,2020-07-18
Navigating Uncertainty: Early Career Academics and Practices of Appraisal Devices,Minerva,2020-12-14
COVID-19 Pandemic Once Again Exposes the Weakest Link in Laboratory Services: Specimen Delivery,Laboratory Medicine,2020-09-15
How many jobs can be done at home?,Journal of Public Economics,2020-07-09
The authors reply,Critical Care Medicine,2020-08-11
"German and Chinese dataset on attitudes regarding COVID-19 policies, perception of the crisis, and belief in conspiracy theories",Data in Brief,2020-10-14
Viral indicators for tracking domestic wastewater contamination in the aquatic environment,Water Research,2020-05-10
Respiratory Viral Infections in Exacerbation of Chronic Airway Inflammatory Diseases: Novel Mechanisms and Insights From the Upper Airway Epithelium,Frontiers in Cell and Developmental Biology,2020-02-25
Comment on “A systematic evaluation of YouTube as an information source for male infertility”,International Journal of Impotence Research,2020-07-18
"Clinical Time Features and Chest Imaging of 85 Patients With COVID-19 in Zhuhai, China",Frontiers in Medicine,2020-05-08
Effects of vitamin D on macrophages and myeloid-derived suppressor cells (MDSCs) hyperinflammatory response in the lungs of COVID-19 patients,Cellular Immunology,2020-12-16
COVID-19 Infection in a Patient With Fragile-X Syndrome,Cureus,2020-10-30
An ethical algorithm for rationing life-sustaining treatment during the COVID-19 pandemic,BJA: British Journal of Anaesthesia,2020-06-02
Overcoming COVID-19: Addressing the perception of risk and transitioning protective behaviors to habits,Infection Control and Hospital Epidemiology,2020-06-09
COVID-19 is accelerating the acceptance of telemedicine in India,Journal of Family Medicine and Primary Care,2020-07-30
Persistence of SARS-CoV-2-specific antibodies in COVID-19 patients,International Immunopharmacology,2020-12-09
Alteration of taste or smell as a predictor of COVID-19,Gut,2020-07-03
Early changes in laboratory parameters are predictors of mortality and ICU admission in patients with COVID-19: a systematic review and meta-analysis,Medical Microbiology and Immunology,2020-11-21
Ste24: An Integral Membrane Protein Zinc Metalloprotease with Provocative Structure and Emergent Biology,Journal of Molecular Biology,2020-03-19
Chest CT Computerized Aided Quantification of PNEUMONIA Lesions in COVID-19 Infection: A Comparison among Three Commercial Software,International Journal of Environmental Research and Public Health,2020-09-22
Challenges faced by mental health providers and patients during the coronavirus 2019 pandemic due to technological barriers,Internet Interventions,2020-06-03
Analyzing the Quality of Twitter Data Streams,Information Systems Frontiers,2020-11-04
Document Addressed to Cardiovascular Echography Operators at the Time of COVID-19: A Document by the “Società Italiana di Ecocardiografia e CardioVascular Imaging” Board 2019–2021,Journal of Cardiovascular Echography,2020-04-13
Predicting the response of the dental pulp to SARS-CoV2 infection: a transcriptome-wide effect cross-analysis,Genes and Immunity,2020-10-03
COVID-19: A promising cure for the global panic,The Science of the Total Environment,2020-04-04
Modeling and Forecasting the COVID-19 Temporal Spread in Greece: An Exploratory Approach Based on Complex Network Defined Splines,International Journal of Environmental Research and Public Health,2020-06-30
Is asthma protective against COVID‐19?,Allergy,2020-06-17
Cellular pathology in the COVID-19 era: a European perspective on maintaining quality and safety,Journal of Clinical Pathology,2020-06-01
K18-hACE2 mice develop respiratory disease resembling severe COVID-19,bioRxiv,2020-08-11
The data room,Developments in Petroleum Science,2020-10-01
Psychological Effects of ‐19 on Parenting and  Mental Health,Dermatologic Therapy,2020-05-13
Beyond protein structure determination with MicroED,Current Opinion in Structural Biology,2020-06-28
Students create new online resource to support peers,British Dental Journal,2020-07-24
Challenges for the dental radiology clinic in times of the COVID-19 pandemic,Oral Radiology,2020-06-20
Managing college operations during the coronavirus outbreak,Journal of the American Pharmacists Association,2020-04-10
ResGNet-C: A graph convolutional neural network for detection of COVID-19,Neurocomputing,2020-12-30
Immediate and long‐term impact of the ‐19 pandemic on delivery of surgical services,The British Journal of Surgery,2020-04-30
Balancing Choices to Recover From the COVID-19 Pandemic,Neurospine,2020-05-18
Regulation of RLR-Mediated Antiviral Responses of Human Dendritic Cells by mTOR,Frontiers in Immunology,2020-09-11
Glass Fragment Injury to the Craniocervical Junction with Interatlantooccipital Penetration to the Subarachnoid Space: Not-To-Be-Missed Important Aspects of Craniocervical Trauma Even in the Middle of the COVID-19 Pandemic: Case Report and Review of Literature,World Neurosurgery,2020-06-16
SARS-CoV-2 Infects the Brain Choroid Plexus and Disrupts the Blood-CSF Barrier in Human Brain Organoids,Cell Stem Cell,2020-10-13
Eleven faces of coronavirus disease 2019,Allergy,2020-04-06
Jason Wong new Deputy Chief Dental Officer,Bdj in Practice,2020-07-06
"Long-Term Non-invasive Ventilation in Children: Current Use, Indications, and Contraindications",Frontiers in Pediatrics,2020-11-05
Role of Personal Protective Measures in Prevention of COVID-19 Spread Among Physicians in Bangladesh: a Multicenter Cross-Sectional Comparative Study,Sn Comprehensive Clinical Medicine,2020-08-28
"Newly Identified Function of Caspase-6 in ZBP1-mediated Innate Immune Responses, NLRP3 Inflammasome Activation, PANoptosis, and Host Defense",Journal of cellular immunology,
Covid-19 uncovers a new challenge for designers,Journal of Intellectual Property Law & Practice,2020-11-11
COVID-19: it is time to balance infection management and person-centered care to maintain mental health of people living in German nursing homes,International Psychogeriatrics,2020-05-12
Keeping a tenuous grasp on HIV gains,The Lancet. HIV,2020-08-04
Autophagy in T cells from aged donors is maintained by spermidine and correlates with function and vaccine responses,eLife,2020-12-15
"COVID-19 Pandemic and Upcoming Influenza Season—Does an Expert’s Computed Tomography Assessment Differentially Identify COVID-19, Influenza and Pneumonias of Other Origin?",Journal of Clinical Medicine,2020-12-28
Differences in midgut transcriptomes between resistant and susceptible strains of  to Cry1C toxin,BMC Genomics,2020-09-14
Sleep-HD trial: short and long-term effectiveness of existing insomnia therapies for patients undergoing hemodialysis,BMC Nephrology,2020-10-20
Antigenic drift of hemagglutinin and neuraminidase in seasonal H1N1 influenza viruses from Saudi Arabia in 2014 to 2015,Journal of Medical Virology,2020-04-01
Increased Mortality and Major Complications in Hip Fracture Care During the COVID-19 Pandemic: A New York City Perspective,Journal of Orthopaedic Trauma,2020-05-27
Protecting the psychological health of children through effective communication about COVID-19,The Lancet. Child & Adolescent Health,2020-03-31
Immune Checkpoints in Viral Infections,Viruses,2020-09-21
Medusavirus Ancestor in a Proto-Eukaryotic Cell: Updating the Hypothesis for the Viral Origin of the Nucleus,Frontiers in Microbiology,2020-09-03
Clinical status determines the efficacy of salivary and nasopharyngeal samples for detection of SARS-CoV-2,Clinical Oral Investigations,2020-10-12
Elective surgery cancellations due to the ‐19 pandemic: global predictive modelling to inform surgical recovery plans,The British Journal of Surgery,2020-05-12
A prospective clinical study of an Ayurveda regimen in COVID 19 patients,Journal of Ayurveda and Integrative Medicine,2020-10-19
Disaster psychiatry and homelessness: creating a mental health COVID-19 response,The Lancet. Psychiatry,2020-08-04
Copper against Covid,"Materials Today (Kidlington, England)",2020-10-11
Fungal Planet description sheets: 1042–1111,Persoonia : Molecular Phylogeny and Evolution of Fungi,2020-06-29
Malaria vector control in sub-Saharan Africa in the time of COVID-19: no room for complacency,BMJ Global Health,2020-09-16
Role of Helmet-Delivered Noninvasive Pressure Support Ventilation in COVID-19 Patients,Journal of Cardiothoracic and Vascular Anesthesia,2020-05-08
Forty years with coronaviruses,The Journal of Experimental Medicine,2020-03-30
"Covid-Quantigene®, sur la piste du Sars-CoV-2",Revue Francophone Des Laboratoires,2020-10-31
Die digitale Transformation der Medizin,Forum,2020-07-03
"Lifestyle, behavior, perception and practices of Nepalese during lockdown due to COVID-19 pandemic",JNMA: Journal of the Nepal Medical Association,2020-09-30
Letter to the Editor in response to the article: “Increase in the risk of type 2 diabetes during lockdown for the COVID19 pandemic in India: A cohort analysis” (Ghoshal et al.),Diabetes & Metabolic Syndrome,2020-07-12
Three-dimensional (3D) lung segmentation for diagnosis of COVID-19 and the communication of disease impact to the public,BMJ Case Reports,2020-08-18
Prognostic Impact of Prior Heart Failure in Patients Hospitalized With COVID-19,Journal of the American College of Cardiology,2020-10-28
Autoimmunity complicating SARS-CoV-2 infection in selective IgA-deficiency,Neurology® Neuroimmunology & Neuroinflammation,2020-08-12
Techniques assisting peptide vaccine and peptidomimetic design. Sidechain exposure in the SARS-CoV-2 spike glycoprotein,Computers in Biology and Medicine,2020-11-21
Meteorological conditions and nonpharmaceutical interventions jointly determined local transmissibility of COVID-19 in 41 Chinese cities: A retrospective observational study,The Lancet Regional Health - Western Pacific,2020-09-06
The pressing questions in multiple sclerosis Care in the era of COVID-19,Journal of the Neurological Sciences,2020-06-23
Guidelines for Dialysis with Reference to COVID-19,Indian Journal of Nephrology,2020-05-21
"Cardiovascular Pathophysiology, Epidemiology, and Treatment Considerations of Coronavirus Disease 2019 (COVID-19): A Review",CJC Open,2020-09-05
Seite eins,Pädiatrie,2020-08-19
SARS‐CoV‐2 infection anxieties and general population restrictions delay diagnosis and treatment of acute haematological malignancies,British Journal of Haematology,2020-05-25
Caring for the self and others: a reflection on everyday commoning amid the COVID-19 pandemic,Socio-Ecological Practice Research,2020-08-24
"Smile Society: A year of student-led outreach, collaboration and adaptation",British Dental Journal,2020-09-25
openEHR Archetype Use and Reuse Within Multilingual Clinical Data Sets: Case Study,Journal of Medical Internet Research,2020-11-02
Information in Spanish on the Internet about the Prevention of COVID-19,International Journal of Environmental Research and Public Health,2020-11-07
COVID-19 y tromboprofilaxis: recomendaciones para nuestra práctica clínica en Atención Primaria,Semergen,2020-09-18
Probiotics: Versatile Bioactive Components in Promoting Human Health,Medicina,2020-08-27
Baricitinib as treatment for COVID-19: friend or foe of thepancreas?,Clinical Infectious Diseases: An Official Publication of the Infectious Diseases Society of America,2020-08-14
Tacrolimus: COVID-19 infection: case report,Reactions Weekly,2020-12-19
The COVID-19 outbreak and the angiotensin-converting enzyme 2: too little or too much?,Nephrology Dialysis Transplantation,2020-05-01
Knowledge and Information Sources About COVID-19 Among University Students in Jordan: A Cross-Sectional Study,Frontiers in Public Health,2020-05-29
COVID-19 pandemic: a sentiment analysis,European Heart Journal,2020-07-17
Can the detection dog alert on COVID-19 positive persons by sniffing axillary sweat samples? A proof-of-concept study,PLoS ONE,2020-12-10
Transferrin receptor 1 levels at the cell surface influence the susceptibility of newborn piglets to PEDV infection,PLoS Pathogens,2020-07-30
Contact lens wear during the COVID-19 pandemic,Contact Lens & Anterior Eye,2020-04-22
Comparison of clinical characteristics of coronavirus disease (COVID-19) and severe acute respiratory syndrome (SARS) as experienced in Taiwan,Travel Medicine and Infectious Disease,2020-03-14
SARS-CoV-2 genomic variations associated with mortality rate of COVID-19,Journal of Human Genetics,2020-07-22
Erratum to: COVID-19 epidemic: disentangling the re-emerging controversy about medical facemasks from an epidemiological perspective,International Journal of Epidemiology,2020-11-04
Estimating the Fiscal Consequences of National Immunization Programs Using a “Government Perspective” Public Economic Framework,Vaccines,2020-09-02
Pulmonary fibrosis in critically ill patients with novel coronavirus pneumonia during the convalescent stage and a proposal for early intervention,Acta Pharmacologica Sinica,2020-11-13
Abiotic and Biotic Determinants of Plant Diversity in Aquatic Communities Invaded by Water Hyacinth [ (Mart.) Solms],Frontiers in Plant Science,2020-08-25
Amenity Migration and Public Lands: Rise of the Protected Areas,Environmental Management,2020-04-27
Digital Citizenship During a Global Pandemic: Moving Beyond Digital Literacy,Journal of Adolescent & Adult Literacy,2020-07-17
Out-of-Hospital Cardiac Arrest during the COVID-19 pandemic in Portugal,Resuscitation,2020-10-15
Digital Health in Cardiac Rehabilitation and Secondary Prevention: A Search for the Ideal Tool,"Sensors (Basel, Switzerland)",2020-12-22
"The prevalence of symptoms in 24,410 adults infected by the novel coronavirus (SARS-CoV-2; COVID-19): A systematic review and meta-analysis of 148 studies from 9 countries",PLoS ONE,2020-06-23
Hand hygiene compliance in Dutch general practice offices,Archives of Public Health,2020-09-12
The use of tear ferning test in cats for evaluation of ocular surface,Acta Veterinaria Scandinavica,2020-05-26
Psychosocial factors associated with symptoms of generalized anxiety disorder in general practitioners during the COVID-19 pandemic,Journal of Investigative Medicine,2020-08-03
Guidelines: Anaesthesia in the context of COVID-19 pandemic,"Anaesthesia, Critical Care & Pain Medicine",2020-06-05
A conceptual framework to untangle the concept of urban ecosystem services,Landscape and Urban Planning,2020-04-27
Recovering From Coronavirus Disease 2019 (COVID-19): Resisting Ageism and Recommitting to a Productive Aging Perspective,The Public Policy and Aging Report,2020-08-26
Telemedicine and technological devices for amyotrophic lateral sclerosis in the era of COVID-19,Neurological Sciences,2020-05-21
Post-containment management of nursing homes: a new public health concern,European Geriatric Medicine,2020-05-13
Collective aeromedical transport of COVID-19 critically ill patients in Europe: A retrospective study,"Anaesthesia, Critical Care & Pain Medicine",2020-11-21
Immediate impact of the COVID-19 pandemic on CTSA TL1 and KL2 training and career development,Journal of Clinical and Translational Science,2020-06-29
"New approximations, and policy implications, from a delayed dynamic model of a fast pandemic",Physica D. Nonlinear Phenomena,2020-08-25
Clinical presentation at the onset of COVID-19 and allergic rhinoconjunctivitis,The Journal of Allergy and Clinical Immunology. in Practice,2020-08-18
Immune checkpoint inhibitors in SARS-CoV-2 infected cancer patients: the spark that ignites the fire?,"Lung Cancer (Amsterdam, Netherlands)",2020-05-11
Psychological stress responses to COVID-19 and adaptive strategies in China,World Development,2020-07-24
High Respiratory Drive and Excessive Respiratory Efforts Predict Relapse of Respiratory Failure in Critically Ill Patients with COVID-19,American Journal of Respiratory and Critical Care Medicine,2020-10-15
Computational identification of disulfiram and neratinib as putative SARS-CoV-2 main protease inhibitors,Mendeleev Communications,2020-08-04
Allergy and asthma in children and adolescents during the COVID outbreak: What we know and how we could prevent allergy and asthma flares,Allergy,2020-05-28
Spontaneous Bleedings in COVID-19 Patients: An Emerging Complication,Cardiovascular and Interventional Radiology,2020-05-17
"Women’s and men’s work, housework and childcare, before and during COVID-19",Review of Economics of the Household,2020-09-06
Protective Strategies in a Simulated Model When Performing Percutaneous Tracheostomies in the COVID-19 Era,Annals of the American Thoracic Society,2020-11-01
Human Touch via Touchscreen: Rural Nurses' Experiential Perspectives on Telehealth Use in Pediatric Hospice Care,Journal of Pain and Symptom Management,2020-06-07
Offline: How to defeat political populism,"Lancet (London, England)",2020-02-13
Potentially modifiable factors to reduce severity of COVID-19 in type 2 diabetes,Nutrition & Diabetes,2020-08-12
Longitudinal hematologic and immunologic variations associated with the progression of COVID-19 patients in China,The Journal of Allergy and Clinical Immunology,2020-05-11
"Enhancing Local Disaster Management Network through Developing Resilient Community in New Taipei City, Taiwan",International Journal of Environmental Research and Public Health,2020-07-24
1572P Psychological impact of the COVID-19 pandemic on health care workers in oncology in Tunisia,Annals of Oncology,2020-09-22
341 Changes in Atypical Discharges before and during the COVID-19 Pandemic,Annals of Emergency Medicine,2020-10-29
Face masks in radiation oncology clinics: based on evidence or source of mistakes?,"Medical Oncology (Northwood, London, England)",2020-08-01
"Application of System Biology to Explore the Association of Neprilysin, Angiotensin-Converting Enzyme 2 (ACE2), and Carbonic Anhydrase (CA) in Pathogenesis of SARS-CoV-2",Biological Procedures Online,2020-06-19
"COVID-19 Trends Among School-Aged Children — United States, March 1–September 19, 2020",Morbidity and Mortality Weekly Report,2020-10-02
Considerations for povidone-iodine antisepsis in pediatric nasal and pharyngeal surgery during the COVID-19 pandemic,American Journal of Otolaryngology,2020-09-19
Guidance for building a dedicated health facility to contain the spread of the 2019 novel coronavirus outbreak,The Indian Journal of Medical Research,2020-04-28
"A pilot volunteer reader programme decreases delirium days in critically ill, adult ICU patients",BMJ Open Quality,2020-07-20
Nasal Microbiota in RSV Bronchiolitis,Microorganisms,2020-05-13
Identification of human adenovirus replication inhibitors from a library of small molecules targeting cellular epigenetic regulators,Virology,2020-07-26
Influence of Players’ Maximum Running Speed on the Team’s Ranking Position at the End of the Spanish,International Journal of Environmental Research and Public Health,2020-11-27
"Efficacy of chloroquine versus lopinavir/ritonavir in mild/general COVID-19 infection: a prospective, open-label, multicenter, randomized controlled clinical study",Trials,2020-07-08
Using statistics and mathematical modelling to understand infectious disease outbreaks: COVID-19 as an example,Infectious Disease Modelling,2020-07-04
1606P Developing a readiness assessment framework for radioligand therapy,Annals of Oncology,2020-09-22
Effect of Active Video Games on Healthy Children’s Fundamental Motor Skills and Physical Fitness: A Systematic Review,International Journal of Environmental Research and Public Health,2020-11-09
"Actual Causes of Death in Relation to Media, Policy, and Funding Attention: Examining Public Health Priorities",Frontiers in Public Health,2020-07-07
Ludwig's angina,British Dental Journal,2020-09-11
The impact of the COVID-19 pandemic on patients awaiting spinal cord stimulation surgery in the United Kingdom: a multi-centre patient survey,British Journal of Pain,2020-08-21
Neuroinvasive potential of a primary respiratory pathogen SARS- CoV2: Summarizing the evidences,Diabetes & Metabolic Syndrome,2020-07-02
"Commentary: Comment on “Early Outpatient Treatment of Symptomatic, High-Risk Covid-19 Patients that Should be Ramped-Up Immediately as Key to the Pandemic Crisis”",American Journal of Epidemiology,2020-07-20
Norepinephrine/oseltamivir: Lack of efficacy and invasive pulmonary aspergillosis secondary to off-label use: case report,Reactions Weekly,2020-08-29
Lung Ultrasound in COVID-19,Indian Pediatrics,2020-07-24
Associates; Can your finances be better prepared for the future?,Bdj in Practice,2020-09-07
Detection of Severe Acute Respiratory Syndrome Coronavirus 2 RNA in Blood Donations,Journal of Laboratory Physicians,2020-09-02
Impact of COVID-19 on Peripheral Arterial Disease Treatment,Annals of Vascular Surgery,2020-06-02
Emergency retinal detachment surgery during Covid-19 pandemic: a national survey and local review,Eye,2020-09-22
Philippine crimes of dissent: Free speech in the time of COVID-19,"Crime, Media, Culture",2020-07-30
IR is an Operational and Financial Hedge for Hospitals during COVID-19,Journal of Vascular and Interventional Radiology,2020-07-23
CRISPR/Cas9: A powerful genome editing technique for the treatment of cancer cells with present challenges and future directions,Life Sciences,2020-10-05
Pivoting Research to ‐19,Annals of Neurology,2020-06-07
Video for Active and Remote Learning,Trends in Chemistry,2020-04-16
"Positive association of angiotensin II receptor blockers, not angiotensin-converting enzyme inhibitors, with an increased vulnerability to SARS-CoV-2 infection in patients hospitalized for suspected COVID-19 pneumonia",PLoS ONE,2020-12-21
Perceived Risk and Protection From Infection and Depressive Symptoms Among Healthcare Workers in Mainland China and Hong Kong During COVID-19,Frontiers in Psychiatry,2020-07-15
Psychological Distress After Covid-19 Recovery: Reciprocal Effects With Temperament and Emotional Dysregulation. An Exploratory Study of Patients Over 60 Years of Age Assessed in a Post-acute Care Service,Frontiers in Psychiatry,2020-11-12
"Awareness, Risk Perception, and Stress during the COVID-19 Pandemic in Communities of Tamil Nadu, India",International Journal of Environmental Research and Public Health,2020-09-30
Evaluation of the Xiamen AmonMed Biotechnology rapid diagnostic test COVID-19 IgM/IgG test kit (Colloidal gold),European Journal of Microbiology & Immunology,2020-09-25
